{
  "source_id": "src-openai-work-crossover-20260727",
  "title": "How AI is expanding what people do at work",
  "url": "https://openai.com/index/how-ai-is-expanding-what-people-do-at-work/",
  "publisher": "OpenAI",
  "source_type": "official",
  "authority_level": "tier_1_official",
  "published_at": "2026-07-27T00:00:00Z",
  "retrieved_at": "2026-07-29T04:00:00Z",
  "evidence_summary": "OpenAI Economic Research 分析超过80万条美国ChatGPT用户消息；16.8%的工作相关消息、43.5%的职业特定消息涉及传统上属于其他职业的任务。",
  "verification_status": "verified",
  "conflicts": []
}
