{
  "source_id": "src-example-official-release",
  "title": "示例：AI 工作流预算治理功能发布",
  "url": "https://example.com/hxp-demo-release",
  "publisher": "Example Organization（示例数据）",
  "source_type": "official",
  "authority_level": "tier_1_official",
  "published_at": "2026-07-29T00:30:00Z",
  "retrieved_at": "2026-07-29T01:00:00Z",
  "evidence_summary": "这是一条仅用于验证数据结构和自动化流程的示例来源，不代表真实新闻或官方发布。",
  "verification_status": "verified",
  "conflicts": []
}