{
  "source_id": "src-github-dependabot-malware-20260728",
  "title": "Dependabot alerts on malicious packages across more ecosystems",
  "url": "https://github.blog/changelog/2026-07-28-dependabot-alerts-on-malicious-packages-across-more-ecosystems/",
  "publisher": "GitHub",
  "source_type": "github",
  "authority_level": "tier_1_official",
  "published_at": "2026-07-28T00:00:00Z",
  "retrieved_at": "2026-07-29T04:00:00Z",
  "evidence_summary": "GitHub Advisory Database接入OpenSSF malicious-packages数据，Dependabot恶意软件告警覆盖由npm扩展至PyPI等更多生态。",
  "verification_status": "verified",
  "conflicts": []
}
